isbn,name,image,rating,review_count,min_age,max_age,language,categories,price,order,type,author,Description
671885626,First Horror (Original),https://m.media-amazon.com/images/I/514D+ba3RrL._SY300_.jpg,4.7 out of 5 stars,703,8,12,English,99 Fear Street,478,1,Paperback,R. L. Stine,The first book in a scary new trilogy contributing to a series with more than 8.5 million copies in print. Here begins the terrifying story of a family who moves into the house that even their neighbors on Fear Street are afraid to enter. Twin sisters must learn the secret of the evil or be the next victims.
B00E6QSXGC,The Second Horror (99 Fear Street Book 2),https://m.media-amazon.com/images/I/51bmQ-YrzKL._SY300_.jpg,4.6 out of 5 stars,220,8,12,English,99 Fear Street,null,2,Paperback,R. L. Stine,"The second volume in an all-new Fear Street trilogy. Brandt thinks moving to Shadyside is great, but he hasn't heard the terrifying stories about his new home--99 Fear Street. He doesn't know about the headless bodies or bleeding walls. And he doesn't know that Cally Frasier still haunts the house and plans gruesome deaths for him and everyone close to him."
B00E2RX0RW,The Third Horror (99 Fear Street),https://m.media-amazon.com/images/I/51S7ITO73HL._SY300_.jpg,4.7 out of 5 stars,179,8,12,English,99 Fear Street,null,3,Paperback,R. L. Stine,"Kody Frasier always swore she'd come back to 99 Fear Street. She knows the spirit of her dead sister, Cally, is trapped there, waiting to be set free. Now Kody is starring in a movie about the evil that murdered Cally, and she hopes she can find and help Cally. But Cally doesn't want to be saved...she wants revenge."
8211833,The Secret Key: Agatha Oddly (1): Book 1,https://m.media-amazon.com/images/I/41aJeYncW4L._SY300_.jpg,4.5 out of 5 stars,"1,366",8,12,English,AGATHA ODDLY,275,1,Paperback,Lena Jones,"Meet thirteen-year-old Agatha Oddly - a bold, determined heroine and the star of a stylish new detective series.Agatha Oddlow has been a detective for as long as she can remember - she's just been waiting for her first big case. And nothing gets bigger than saving the City of London from some strange goings-on.With a scholarship to the prestigious St Regis School, a cottage in the middle of Hyde Park, a room full of beloved sleuthing novels and a secret key that gives her access to a whole hidden side of London, Agatha is perfectly poised to solve the mystery of what's going on. But just who can she trust when no one is quite who they seem..."
8211892,Murder At The Museum : Agatha Oddly Book 2,https://m.media-amazon.com/images/I/51IOlYHrFAL._SY300_.jpg,4.6 out of 5 stars,826,8,12,English,AGATHA ODDLY,276,2,Paperback,Lena Jones,"A second mystery for thirteen-year-old Agatha oddly - a bold, determined heroine, and the star of this stylish new detective series. Agatha oddlow's set to become the youngest member of the gatekeepers' Guild, but before that, she's got a mystery to solve! There's been a murder at the British museum and, although the police are investigating, Agatha suspects that they're missing a wider plot going on below London - a plot involving a disused tube station, a huge firework display, and five thousand tonnes of gold bullion...."
8211957,Agatha Oddly (3) -- The Silver Serpent,https://m.media-amazon.com/images/I/51UrMGvZlQL._SY300_.jpg,4.6 out of 5 stars,691,8,12,English,AGATHA ODDLY,290,3,Paperback,Lena Jones,"A third mystery for thirteen-year-old Agatha oddly - a bold, determined heroine, and the star of this stylish new detective series. Agatha Oddlow is on the case with yet another adventure! An Assistant at the national gallery has gone missing, but when Agatha begins investigating, she uncovers a plot bigger than she could ever have imagined. Join Agatha as she travels throughout London and into the very heart of the mystery...."
1474959520,Anisha Accidental Detective,https://m.media-amazon.com/images/I/51Kd8VIfgfL._SY300_.jpg,4.7 out of 5 stars,466,8,12,English,"Anisha, Accidental Detective",279,1,Paperback,Serena Patel,"""Perfect for younger detectives. So funny and clever and sweet."" Robin Stevens HELP! My super-dramatic Aunty Bindi is getting married tomorrow and she's having a mega meltdown. But sssh! I've just found a ransom note, pushed through the letter box, saying Uncle Tony, Bindi's husband-to-be, has been kidnapped, and will only be freed if the wedding is cancelled! I have to keep this a secret otherwise it'll be panic-central... I guess it's up to me - Anisha, ACCIDENTAL DETECTIVE, to save the day."
1474959539,"School's Cancelled (Anisha, Accidental Detective - Book 2)",https://m.media-amazon.com/images/I/51orGjA6sVL._SY300_.jpg,4.8 out of 5 stars,195,8,12,English,"Anisha, Accidental Detective",263.19,2,Paperback,Serena Patel,"""An absolute joy from start to finish!"" Jennifer Killick on Anisha, Accidental Detective ""I've been working sooo hard with Milo and Govi to make our super-erupting volcano for the school science fair. I really thought we might win first prize - a trip to the National Space Centre. But now we're in BIG trouble. One minute we were in the lab practising our science demo, and the next thing we knew, our volcano exploded and flooded the corridors. School had to be cancelled! But did we really get our project so wrong - or is someone else trying to win first prize? Looks like a case for Anisha, Accidental Detective!"" Shortlisted for a Blue Peter Book Award"
1474959547,Granny Trouble,https://m.media-amazon.com/images/I/51n7TqkZXYS._SY300_.jpg,4.7 out of 5 stars,77,8,12,English,"Anisha, Accidental Detective",301,3,Paperback,Serena Patel,"Milo and I have been looking forward to this half-term for what feels like FOREVER - we're finally going to the National Space Centre, to meet a real-life space engineer! My whole family wanted to tag along and visit a festival first, where this super-famous, mega-expensive diamond is on display. But guess what? The diamond has been STOLEN! And the police think MY GRANNY did it so she's in serious TROUBLE. Someone needs to prove Granny Jas is innocent, so it looks like Milo and I might need to go UNDERCOVER. It's lucky I'm Anisha, Accidental Detective!"
1474989756,Anisha Accidental Detective Show Stoppers,https://m.media-amazon.com/images/I/51Y8PvyIQuL._SY300_.jpg,4.8 out of 5 stars,35,8,12,English,"Anisha, Accidental Detective",293.18,4,Paperback,Serena Patel,"The school show must go on, in the fourth hilarious mystery in the award-winning Anisha, Accidental Detective series!JUST ONE WEEK UNTIL SHOWTIME!I'm SO busy - our class is putting on a musical, and we only have ONE WEEK before curtain up. And, as it's nearly DIWALI, Granny Jas is cooking non-stop, and Auntie Bindi is determined to BRING THE BLING. I'm leaving the theatrics to Milo, but as the director's assistant I have LOADS to do...especially now everything is going WRONG. Even Molly the cat is forgetting her cues! Miss Jive believes the show is CURSED, but I think someone is trying to STOP THE SHOW! Time for me, ANISHA, ACCIDENTAL DETECTIVE, to step into the spotlight!Praise for the Anisha, Accidental Detective series:Winner of the Sainsbury's Children's Book Prize and of the Crimefest Best Crime Novel for ChildrenShortlisted for the Blue Peter Book Award, the British Book Awards Children's Book of the Year, and the Laugh Out Loud Book Award""DELIGHTFUL! Perfect for younger detectives - so funny and clever and sweet"" Robin Stevens, author of the Murder Most Unladylike series""An absolute joy"" Jennifer Killick, author of Crater Lake""Super funny and packed with lovable characters"" Swapna Haddow, author of Dave Pigeon"
1801310904,"Anisha, Accidental Detective: Holiday Adventure",https://m.media-amazon.com/images/I/51r8qbdWcRL._SY300_.jpg,4.8 out of 5 stars,29,8,12,English,"Anisha, Accidental Detective",296.6,5,Paperback,Serena Patel,"Winner of The Week Junior Book Awards Children's Book of the Year: Younger FictionThe Mistrys are off on holiday, in the fifth hilarious mystery in the award-winning Anisha, Accidental Detective series!Pack your bags - we're off to a holiday camp! Milo can't wait to see the wildlife, Manny's learning survival skills, and even Granny's going to have a go at archery. Honestly, I just want to read my book, but there's NEVER any time to relax for Anisha, Accidental Detective. The holiday park's mascot, Delilah the duck, has been DESTROYED, and my new friend Cleo is everyone's number one suspect. But I'm sure she's innocent, and I'm going to do whatever it takes to prove it. Let's hope we can find the real culprit, and QUACK the case!!Praise for the Anisha, Accidental Detective series:Winner of the Sainsbury's Children's Book Prize and of the Crimefest Best Crime Novel for ChildrenShortlisted for the Blue Peter Book Award, the British Book Awards Children's Book of the Year, and the Laugh Out Loud Book Award""DELIGHTFUL! Perfect for younger detectives - so funny and clever and sweet"" Robin Stevens, author of the Murder Most Unladylike series""An absolute joy"" Jennifer Killick, author of Crater Lake""Super funny and packed with lovable characters"" Swapna Haddow, author of Dave Pigeon"
141339098,Artemis Fowl (Book 1) [Paperback] Eoin Colfer,https://m.media-amazon.com/images/W/MEDIAX_792452-T1/images/I/51+yuk2qIIL._SY300_.jpg,4.5 out of 5 stars,"7,909",8,12,English,Artemis Fowl,285,1,Paperback,Eoin Colfer,"Rumour has it Artemis Fowl is responsible for every major crime of the new century. Just twelve years old and already he's a criminal genius, plotting to restore his family's fortune with a spot of corruption and kidnapping. Kidnapping a fairy for ransom, to be precise."
141339101,"Artemis Fowl and The Arctic Incident (Book 2) (Artemis Fowl, 18) [Paperback] Eoin Colfer [Paperback] Eoin Colfer",https://m.media-amazon.com/images/W/MEDIAX_792452-T1/images/I/51fIw2w+aGL._SY300_.jpg,4.7 out of 5 stars,"4,037",8,12,English,Artemis Fowl,267,2,Paperback,Eoin Colfer,"Criminal Mastermind Artemis Fowl never stops scheming... Artemis' father has been missing for almost two years. His location? The Arctic Circle, where the Russian Mafiya are holding him prisoner. Now Artemis must execute a daring rescue operation to get his father back. But that's not his only problem."
014133911X,Artemis Fowl (3) & Eternity Code (REI) [Paperback] Eoin Colfer,https://m.media-amazon.com/images/W/MEDIAX_792452-T1/images/I/51cgu8KmAQL._SY300_.jpg,4.7 out of 5 stars,"2,984",8,12,English,Artemis Fowl,306,3,Paperback,Eoin Colfer,"Artemis Fowl has created the most powerful new supercomputer known to man - using stolen technology from an elite race of underground fairies. And when the computer falls into the hands of an IT billionaire with a shady past and an alleged mob connection, Artemis is in deep trouble. The consequences for humans and fairies alike are deadly."
141339136,Artemis Fowl (4) & Opal Deception (REI) [Paperback] Eoin Colfer,https://m.media-amazon.com/images/W/MEDIAX_792452-T1/images/I/51a+MYUSvBL._SY300_.jpg,4.7 out of 5 stars,"3,077",8,12,English,Artemis Fowl,272,4,Paperback,Eoin Colfer,Arch-Criminal Artemis Fowl's mind has been wiped. Now someone wants him dead. Artemis Fowl is the only boy ever to have discovered an armed and dangerous fairy race living below ground. He just can't remember any of it.
141339144,Artemis Fowl And The Lost Colony [Paperback] Eoin Colfer,https://m.media-amazon.com/images/W/MEDIAX_792452-T1/images/I/51Yd75rwkTL._SY300_.jpg,4.7 out of 5 stars,"2,885",8,12,English,Artemis Fowl,289,5,Paperback,Eoin Colfer,"Artemis Fowl And The Lost Colony is the fifth instalment in the riveting Artemis Fowl series. It continues with the adventures of the teenaged genius Artemis Fowl.Till now, the fairies' existence was only a matter of Artemis' knowledge but, this time around, it's a different game altogether. A 12-year old female genius is on the mission of capturing a demon for her own scientific experiments. However, she does not have any idea of the hell that her mission is going to let loose on Earth.The demons are the sore enemies of humans. The only way to prevent the massacre is for Artemis to stop an ancient spell that is going to unleash the demons on the humans. If he fails, it will result in the mass destruction of the human beings at the hands of the blood-thirsty demons.Artemis Fowl And The Lost Colony, just like its prequels, is filled with thrills, adventure and twists in the plot. It was published by Penguin UK in a re-issue edition in 2011 and it is available in paperback.Key Features:The book received a lot of positive reviews from critics, including The Times.The relationship between Artemis and Holly, the female rival of Artemis, is one of the highlights of the book."
141339128,"Artemis Fowl and The Time Paradox (Book 6) (Artemis Fowl, 22) [Paperback] Eoin Colfer",https://m.media-amazon.com/images/W/MEDIAX_792452-T1/images/I/51QPfZguxiL._SY300_.jpg,4.7 out of 5 stars,"2,715",8,12,English,Artemis Fowl,272,6,Paperback,Eoin Colfer,"Artemis Fowl is no stranger to trouble. In fact he's a magnet for it. Man-eating trolls, armed and dangerous (not to mention high-tech) fairies, flame-throwing goblins - he's seen the lot. He had decided to forego criminal activity of the more magical kind. However... Now his mother is gravely ill."
141328037,"Artemis Fowl And The Atlantis Complex (Artemis Fowl, 23) [Paperback] Eoin Colfer",https://m.media-amazon.com/images/W/MEDIAX_792452-T1/images/I/51LEC++EBDL._SY300_.jpg,4.7 out of 5 stars,"2,987",8,12,English,Artemis Fowl,295,7,Paperback,Eoin Colfer,"The seventh book from the Artemis Fowl series, Artemis Fowl And The Atlantis Complex, starts off with Artemis calling Captain Holly Short, Foaly and Wing Commander Vinyaya over for a meeting. Artemis invites them to an isolated place in Iceland. He claims to have invented the Ice Cube, with which he can stop global warming. They arrive to find Artemis behaving strangely and later discover that he is affected by the Atlantis Complex.The Atlantis Complex is a mental disorder where the person experiences symptoms like hallucinations, difficulty in concentration, anxiety, depression and so on. At the same time, they also find out that the city of Atlantis is under attack by a deadly foe from Holly's past. But Artemis can be of no help to them because of his condition. They have to try and cure him before they can even think of fighting their powerful enemies.Artemis Fowl And The Atlantis Complex, written by Eoin Colfer, was published by Penguin UK in 2011. It is available in paperback format.Key Features:Artemis Fowl And The Atlantis Complex is the seventh book in the highly popular Artemis Fowl series.This novel is the penultimate book in the Artemis Fowl series. The eighth and final book, The Last Guardian, was released in 2012.Artemis Fowl And The Atlantis Complex was reviewed as 'Fast, funny and very exciting' by the Daily Mail."
141340762,"Artemis Fowl and The Last Guardian (Book 8) (Artemis Fowl, 24) [Paperback] Eoin Colfer",https://m.media-amazon.com/images/W/MEDIAX_792452-T1/images/I/512SHOF1RXL._SY300_.jpg,4.8 out of 5 stars,"4,086",8,12,English,Artemis Fowl,294,8,Paperback,Eoin Colfer,"Is this Armageddon for Artemis fowl? Opal Koboi, power-crazed pixie, is plotting to exterminate mankind and become fairy queen. If she succeeds, the spirits of long-dead fairy warriors will rise from the earth, inhabit the nearest available bodies and wreak mass destruction."
1474972144,The Haunting of Aveline Jones,https://m.media-amazon.com/images/I/51sifUA8AwL._SY300_.jpg,4.7 out of 5 stars,732,8,12,English,Aveline Jones,359,1,Paperback,Phil Hickes,"Turn on your torches and join Aveline Jones! Aveline loves reading ghost stories, so a dreary half-term becomes much more exciting when she discovers a spooky old book. Not only are the stories spine-tingling, but it belonged to a girl called Primrose Penberthy, who vanished mysteriously, never to be seen again. Intrigued, Aveline decides to investigate Primrose's disappearance, with some help from her new friend, Harold. Now someone...or something, is stirring. And it is looking for Aveline. The first in a deliciously spine-tingling, spooky new series, where mysteries are always solved, spirits are always laid to rest, and everybody gets to bed on time. Perfect for adventurers aged 9+ and fans of Michelle Harrison, Piers Torday and Jamie Littler."
1474972152,The Bewitching of Aveline Jones: The second spellbinding adventure in the Aveline Jones series,https://m.media-amazon.com/images/I/51ooaoiTUlL._SY300_.jpg,4.7 out of 5 stars,330,8,12,English,Aveline Jones,646,2,Paperback,Phil Hickes,"Turn on your torches and join Aveline Jones!Aveline is thrilled when she discovers that the holiday cottage her mum has rented for the summer is beside a stone circle. Thousands of years old, the local villagers refer to the ancient structure as the Witch Stones, and Aveline cannot wait to learn more about them.Then Aveline meets Hazel. Impossibly cool, mysterious yet friendly, Aveline soon falls under Hazel's spell. In fact, Hazel is quite unlike anyone Aveline has ever met before, but she can't work out why. Will Aveline discover the truth about Hazel, before it's too late?Join the world of Aveline Jones, where mysteries are solved, spirits are laid to rest, and everybody gets to bed on time. Perfect for adventurers aged 9+ and fans of Michelle Harrison, Piers Torday and Jamie Littler."
1474972160,The Vanishing of Aveline Jones,https://m.media-amazon.com/images/I/51e+tiR4xpL._SY300_.jpg,4.8 out of 5 stars,126,8,12,English,Aveline Jones,646,3,Paperback,Phil Hickes,"Turn on your torches and join Aveline Jones!Aveline is determined to discover the truth behind her uncle's mysterious disappearance when she travels to his home with Mum and Aunt Lilian. After years of hoping Aveline's uncle would return, they have finally decided to sell his house - but Aveline and Harold have other plans. Sneaking into her uncle's study, Aveline discovers he had been researching possible supernatural activity around an ancient burial mound - and linked this with the unexplained disappearances of other local villagers. Dark, magical forces are at work, and they'll do anything to remain hidden, as Aveline and Harold soon learn...Join the world of Aveline Jones, where mysteries are solved, spirits are laid to rest, and everybody gets to bed on time. Perfect for adventurers aged 9+ and fans of Michelle Harrison and Jennifer Killick."
1515827496,"Gabi's If/Then Garden (Code Play) (1 August, 2018)",https://m.media-amazon.com/images/W/MEDIAX_792452-T1/images/I/51-1PGu31HL._SY300_.jpg,4.8 out of 5 stars,34,4,6,English,Code Play,660,null,Paperback,Caroline Karanja,"Gabi's garden needs some help. Where to begin? Gabi and her best friend Adi use if/then statements to decide what to plant, what to water, and what to pick! These scientific thinkers find ways every day to use computer coding concepts to make work and play more fun!"
1515827488,"Adi's Perfect Patterns and Loops (Code Play) (1 August, 2018)",https://m.media-amazon.com/images/W/MEDIAX_792452-T1/images/I/517wEgJ4ynL._SY300_.jpg,4.7 out of 5 stars,25,4,6,English,Code Play,631,null,Paperback,Caroline Karanja,Best friends Adi and Gabi love to play with Adi's toy train. Round and round it goes-choo choo! Watching it loop the track gives the girls an idea. These scientific thinkers use their computer coding knowledge to put the train to work!
151582750X,"ADI Sorts with Variables (Code Play) (1 August, 2018)",https://m.media-amazon.com/images/W/MEDIAX_792452-T1/images/I/51m+dRwyZRL._SY300_.jpg,4.9 out of 5 stars,21,4,6,English,Code Play,660,null,Paperback,Caroline Karanja,It's time to clean Adi's room! If only a computer could do it for her! That gives Adi and her best friend Gabi an idea-think like a coder! These scientific thinkers put on their computer coding caps and make cleaning up a snap by sorting with variables!
151582747X,"Gabi's Fabulous Functions (Code Play) (1 August, 2018)",https://m.media-amazon.com/images/W/MEDIAX_792452-T1/images/I/51i1+mCcqKL._SY300_.jpg,4.8 out of 5 stars,13,4,6,English,Code Play,624,null,Paperback,Caroline Karanja,Computer coding in the kitchen? Yes! Best friends Gabi and Adi are baking a special birthday treat--and making a recipe is a lot like creating a function in a computer code. These scientifically minded junior programmers are always on the lookout for ways to work coding concepts into their day with Code Play!
7554486,"Parent Agency (30 June, 2015)",https://m.media-amazon.com/images/W/MEDIAX_792452-T1/images/I/51UbXu+WeTL._SY300_.jpg,4.5 out of 5 stars,"3,883",8,12,English,David Baddiel,319,null,Paperback,David Baddiel,"Barry said, a third time, ""I wish I had better parents!"" And then suddenly the entire room started to shake. Barry Bennett hates being called Barry. In fact it's number 2 on the list of things he blames his parents for, along with 1) 'being boring' and 3) 'always being tired'. But there is a world, not far from this one, where parents don't have children. That's far too random for something so big and important. In this world, children are allowed to choose their parents. For Barry Bennett, this world seems like a dream come true. Only things turn out to be not quite that simple."
8365385,"The Taylor Turbochaser (15 November, 2019)",https://m.media-amazon.com/images/W/MEDIAX_792452-T1/images/I/51oA2CR+dvL._SY300_.jpg,4.7 out of 5 stars,"1,527",8,12,English,David Baddiel,259,null,Paperback,David Baddiel,"It's the latest brilliant blockbuster from best-selling Baddiel! A non-stop thrill-ride adventure that will have readers young and old racing to the finishing line. The Taylor turbochaser is a road-trip rollercoaster... with a twist. At its heart is the unforgettable Amy Taylor. Amy loves cars, and dreams of being a driver. But there's a major catch: her slow old wheelchair with its broken wheel. When Amy finally gets a new electric one, it's exciting... at first. But standard engines only have so much power. And that's where Rahul comes in - amy's best friend and genius inventor. Soon Rahul turns a wheelchair into... a super car! And so the Taylor turbochaser is born. But when it all goes suddenly wrong Amy is going to have to hit the road - and drive...."
7554540,"The Person Controller (30 April, 2016)",https://m.media-amazon.com/images/W/MEDIAX_792452-T1/images/I/516QqjdKd1L._SY300_.jpg,4.7 out of 5 stars,"2,924",8,12,English,David Baddiel,316,null,Paperback,David Baddiel,"From the author of THE PARENT AGENCY comes a thrilling, funny and touching new adventure. Fred and Ellie are twins. But not identical (because that's impossible for a boy and a girl).They do like all the same things, though. Especially video games. Which they are very good at. They aren't that good, however, at much else - like, for example, football, or dealing with the school bullies. Then, they meet the Mystery Man, who sends them a video game controller, which doesn't look like any other controller they've ever seen. And it doesn't control any of their usual games. When the twins find out what it does control, though, it seems like the answer to all their problems. And the key to all their wildest dreams. At least it seems like that..."
8185166,"ANIMALCOLM (30 June, 2017)",https://m.media-amazon.com/images/W/MEDIAX_792452-T1/images/I/51p1opBT36L._SY300_.jpg,4.7 out of 5 stars,"1,880",8,12,English,David Baddiel,299.92,null,Paperback,David Baddiel,"From David Baddiel, the brightest new star of children's books and winner of the LOLLIES award, comes a laugh-out-loud adventure for every child who ever wondered what it might be like to be a bit of an animal...Malcolm doesn't like animals.Which is a problem because his family love them. Their house is full of pets. What the house is NOT full of is stuff Malcolm likes. Such as the laptop he wanted for his birthday.The only bright spot on the horizon is the Year Six school trip, which Malcolm never thought his parents would pay for. and yet there he is, on the bus, heading to... oh no. A farm.Over the next days, Malcolm changes. He learns a lot about animals. More, in many ways, than he would like. He learns what it's really like to be an animal. A whole series of animals, in fact...It does make him think differently. and speak differently. and eat differently. And, um, smell differently. But will he end up the same as before?Because sometimes the hardest thing to become is... yourself."
8334226,"Future Friend (31 October, 2020)",https://m.media-amazon.com/images/W/MEDIAX_792452-T1/images/I/51ISlS0fs-L._SY300_.jpg,4.8 out of 5 stars,"2,240",8,12,English,David Baddiel,324,null,Paperback,David Baddiel,"From million-copy bestselling author David Baddiel comes a laugh-out-loud and inspiring new adventure for all readers of 8 and up that is ahead of its time - 1,001 years ahead, to be precise...The year is 3020. Pipat256X#YY. 3_7 is lonely and bored: she goes to virtual school on her G-Glasses, she only has a talking cat and parrot to hang out with, and she can't even leave her LivingSpace due to the extreme heat and floods outside. Until the day that Pip explores a glowing ring in a lab and finds herself in a warehouse, in 2019. Where she meets boy-inventor Rahul - who is also lonely and bored. Together, Rahul and Pip are no longer lonely. But they have a whole load of new problems, including hiding talking animals from Rahul's parents, and finding a way back to the future. Plus - just maybe - saving the world...Future Friend is a terrifically entertaining time-slip adventure that combines action, laugh-out-loud humour and the importance of friendship, in a story that asks the question - what would happen if your best friend came from the future?"
