ISBN13,Review,Author
9780316077040,"After the pleasing end of Beautiful Creatures I was eager to read Beautiful Darkness immediately to remain in the diverse Caster universe and don't quit my quality time with Ethan yet. But I also feared the looming conflict between Lena and Ethan growing to a concrete, which is, as Beautiful Darkness is the second book in a quartet, almost inevitable to provide the structure of an overall suspense curve. Where other novels exercise the obligatory separation of our couple by keeping them away from each other completely, Ethan and Lena still got a kind of psychical connection and are only physically separated. So the importance of Ethan and Lena's psychical bond is once again accentuated. I am looking forward to learn more about their special connection in the next two books. As in Beautiful Creatures, the story is told from Ethan Wate's point of view whose character is as adorable and charming as in the first Caster Chronicles novel. There are very few male narrators in YA fantasy novels, because female authors often tend to apply female narrators I think. Although Lena's development and her decisions around becoming a light or dark Caster form the centre of the Caster Chronicles series, the story is told from Ethan's point of view. In my opinion this choice of perspective is the best the authors could have applied, because experiencing Lena through the eyes of Ethan, and so someone who loves her and cares about her fate, establishes a very intense connection with her although she isn't our narrator and supports the mysterious atmosphere of the whole story. Interesting about Beautiful Darkness is, that we see the happenings through Ethan's eyes, but are at the same time accomplice with Lena. Keeping a secret from Ethan almost broke my heart. In Beautiful Creatures there was a particular short chapter, told from Lena's point of view and I haven't read a novel before in which a single chapter of the first novel has such an enormous impact on its sequel. The conflict grows slowly but steadily and the secrets kept accumulate into an adventurous race for life or death. Various plot strands build a delicately branched web of an unforeseeable suspense you can't but get caught in. In the end there seem to be many secrets unsolved and still a gigantic potential left. Not only main characters show major changes, secondary characters, too. Characters being cold and resistant before finally show feelings, evil and cruel characters become even crueller. Also many new characters are introduced. Some are new allies, friendly and light, others are even darker than the already established Beautiful Creatures villains. A satisfying sequel to Beautiful Creatures, full of all-consuming emotions, inevitable decisions and unforeseeable outcomings. Do you already feel the beautiful darkness creeping into your heart? THE VERDICT Again, a beautifully written novel by the talented casters Garcia and Stohl. They once again proof their talent to apply witty elements and develop an extensive storyline by creating an universe of a novel which is as huge and infinite as the Caster sky itself. And as many constellations there are to spot, there are just as many opportunities for exciting and new story elements, special abilities and characters. New fantasy elements meet solid writing style- The Caster world fills the gap between werewolves and vampires, faeries and magicians and leaves an urgent need for more.",MissPageTurner
9780141326092,"Frankly speaking, I found the first book (Beautiful Creatures, now, a big movie franchise) too much of a drag to read mainly because of how prolonging it was. I wasn't planning on reading or listening to the rest of the series anytime soon. But thanks to my eldest sister's audiobook, I managed to finish it within 3 days. Best thing about this is that I get to listen to it while I worked. I call it 'double productivity' and with that double productivity, I actually grew to love the series! When the book started, I groaned and I did it because the author(s) reuses the same plot from the first book and renames it 17th Moon instead of 16th Moon. Then they begin to write circles and differences around it. But you've got to hand it to them, they did write a damn good book! Ethan (the main character) is a sweetheart and in this installment, the poor guy goes through heaven and hell for Lena (his female counter part). Man, I hate Lena. She's such a victim I can't stand. Even worse are the decisions that she makes, and the fact that she completely doesn't confide in Ethan, like they used to, makes me groan some more! I even rolled my eyes at her a couple of times. I am so happy I don't have to deal with her as the main character. I wouldn't want to get stuck in that head of hers. In the end, my favorite character is Link (Ethan's lame best friend) instead of Ethan. He's one of those dorky characters that will make you cry and laugh at the same time. He can even be considered as the ""Ron Weasley"" of the whole series. He is very much linked to the end of this installment that will literally blow your mind with it's awesomeness! Likewise, we've got the adversaries of Ethan and his gang. The mastermind of the whole evilness reminds me too much of the bad guy in The Hunger Games. But then again, nothing is really new out there. Now, for the beautiful yet gothic land of Gaitlin, South Carolina. So dark, so mystical. I just want to move into this fictional town and spend the rest of my life doing the things I love with the people I love. Of course, I'll only live there if the fictional characters of Gaitlin weren't. If you dislike the characters, you sure won't dislike the town they live in (minus the people). Gaitlin isn't just a home for humans but also Witches or Casters as they like to be called. The world Stohl and Garcia creates for the Casters is so dark and haunting, you can't help but call it beautiful. Undoubtedly, I adored the book. The writing style is flat out written for not only the teens but for mothers, fathers, older brothers, etc. Some characters will surely keep you glued to the book while the storyline remains with the same foundation but still has the ability to keep the reader going, and most importantly, the book encompasses the Beautiful Darkness that continues to draw me even closer to the characters and overall, to the entire series. And with that, I quickly moved to the 3rd book and I'm half way done with the book!",Najla Qamber
9780141326092,"What else can I say? Wonderful. Amazing. Thrilling. Frustrating. Yes, very frustrating. Lena drove me nuts. That John Breed irritated me to death but you can't blame him. Ethan is love as always. Link and the Sisters are smashing. They just brought to life the pages of the book they're in. Oh, yeah..Ridley too. They're fantastic. I can't wait to read what's going to happen next XD",Joy Chuah Xin Yee
9780316231657,"My review: This book was already a movie by the time I began the series, which I have since seen and will talk about in a different post soon! I really liked this book, more than I expected to. For some reason, I went into it thinking it was going to be somewhat corny/sappy romance with the other elements to make it a truly well-rounded story. But there is a little bit of everything in this book... secrets, mystery, angst, magic, and more. There were two things that truly made a great foundation for this book, and really the whole series. One was that it is written to be a somewhat multi-generational story, weaving in and out of family histories. There is a lot of richness to be had in that kind of family saga. The other thing I liked was the gothic element that wove together the love between Lena and Ethan and the darkness that made up the paranormal elements of the story. The story is set in a quintessential southern town, still reliving the Civil War and making it a deep part of the town's culture. But, even with the occasional trips back in time, this could not be labeled historical fiction. Instead that history served as a backdrop for the story. Things to love about Beautiful Creatures... --The character of Lena. I loved that she wasn't created to be the epitome of teenage perfection. She struggled deeply with darkness and that made her so much more believable and likable. --The alternate world. I loved how the authors created a world for the Casters and laid it on top of our own. The existence of the Caster Library is an example of this. A magical library with a librarian that exists below the regular library. The mythology of magic was thoroughly blended with that of the mundane. --The ending. It left a fabulous opening for the next book. --The POV. It was told from the POV of Ethan, instead of the usual female lead. This was refreshing! Things I wanted more of... --The mythology of the Caster world. I am hoping that this is explored is explored more full in subsequent books. My recommendation: If you like paranormal YA, I would suggest this. I liked the characters a whole lot more than those of certain vampire fiction. There is darkness and angst, but it doesn't overload the teenage emo attitude. I will definitely be reading the next book",Kim
9780141326085,"It took me a while to start this book. And then it took me a while to read it through. Yes, it's a good read, but the overall writing wasn't as captivating as I expected. It's kind of slow paced, and occasionally just not that fluent. There's the whole thing with the Civil War. Yes, it's somewhat important part of the characters' history, but all the historical reenactments and history lessons just didn't do it for me. Same with the DAR and PTA. Witch hunt also included, but that was a big part of the plot, so that I could have lived with. Parts about the Civil War could have been completely removed, and I probably wouldn't have noticed a difference. They only distracted me, and I wished those parts were replaced with Ethan's and Lena's romance. Since there could have been so much more details about that, then I would've been happy. Overall, I liked Ethan and Lena. A couple, who are destined to be together, though the fate is against them. Especially when we find out the thing about Mortals and Casters not working so well together. Ethan is a narrator, which was interesting considering women authors. Despite that, Ethan was a believable character. He's blind to Lena's flaws, but isn't that how it always is when you're madly in love with someone. They're the perfection and you would do anything for them. So Ethan's quite the knight in shiny armor through out the book. And Lena. She seems so nice. So, so nice. She would never even hurt a fly, except when she loses the control of her powers. But then again, when she gains the control, her niceness starts cracking. The thing with the book and sort of brainwashing her aunt and cousin? Not nice! So even though I liked her and Ethan together, I liked Ethan more. There's a bunch of other people hanging around, but only few I really liked, being Uncle Macon, Link and Ridley. Believe it or not, I really liked her! Especially the thing with ""Sympathy for the devil""- song, that was quite funny. Luckily, there's more of her in the second book! Overall, a good read. The ending saved the whole book, before that I had some troubles following the story, but the end was loud and clear. I cried like a baby. Like I always do, when there's a good story going on. This was the reason I started book 2 right away!",Monaliz @ Mind Reading?
9780141326085,"A lot of people have recommended this read to me so I just had to pick it up. For the most part it was a good read for me. A boy growing up in a town that he wants to get away from and a new, completely unusual girl comes into the picture that interests him because she's so different to what he's used to. It's the basis of a story that can go anywhere. It had a lot of exciting and shocking events within the story that made me feel for the main characters but the problem was it went on too long. It's fine for a book to be over 500 pages, but when it gets repetitive it's hard to finish for the storyline and not for the sake of finishing it because I had already read 400 pages. The characters themselves were great. Lena was a strong character that didn't take no for an answer and Ethan was sweet. The supporting characters were good too. Link (Ethan's best friend) was funny and seemed to be the opposite to Ethan which was probably why they fit so well. The characters that are there to sort of test the protagonists - which they did in bucket loads - were written really well. Beautiful Creatures is all about this curse that Lena has. It's all about counting down to Lena's sixteenth birthday when something disastrous is going to happen. The build up to the birthday is full of suspense which is definitely what kept me reading. Which brings me to another problem I had. The timing of this book was brilliant until it got closer to the birthday. It just seemed like as it got closer to the date in the book the time gap between events got shorter and shorter which put me off a little. It wasn't evenly distributed if that makes sense. Something would happen and then readers are reminded the date is three months away, but then something else would happen and then reader's are reminded that the birth day is the next week. It was a little frustrating. The setting of the story - a small town called Gatlin - was brilliantly written. It was a place that was meant to be suffocating and stuffy. It was meant to put people off, at least people who had any sense according to Ethan. I think it was the perfect place for a story like Beautiful Creatures to take place. Gatlin was probably my most favourite aspect of the novel. Overall, I did enjoy this read because it has a little of everything. I do recommend it for those who like novels filled with suspense, nasty schoolgirls and sweet romance that develops in its own time.",Maryam H
9780141326085,i love the humor in this story and i enjoyed it. i cant wait until im into Beautiful Darkness! This is a kewl story and i LOVE this book! (:,Ashley
9780141326085,"I like the humor in the story lines. Chapter one, and the book had me giggling on my lunch break with everybody giving me looks in the staff room. I think that earned the storytelling quality a 4 out of 5. The story itself even if it is not terribly original is quite captivating. The authors have seamlessly blended modern day teen culture with paranormal fantasy that as a reader I could believe in. If I have to grade the ""suspension of disbelief"" for this story I will have to give it a 4.5 out of 5. The ending however is a cliffhanger. Although the ending did close the book nicely, it is also the beginning of the next book. Gave the impression that the whole book is just chapter one of a bigger book. That earned a 2 out of 5. The cover art? It could do better. I have seen this book for sometime now in the blogosphere but ignored it for a few months just because I do not find the cover attractive to my fantasy reader's eyes. The art department who did this cover needs to be fired. In a marketing graph, this cover art would be a 1 out of 5. Overall, this book is a 3.5 out of 5.",Cherry
9780141326085,"Firstly, I have to say I had a slight giggle to myself about the green eyes and black hair (I should really start a list to see how many paranormal protagonists we can find with green eyes and/or black hair). The first person narrative is written from the perspective of the male protagonist (Ethan) something I did find hard to relate to being a girl and having three girls myself (J has to get in touch with his feminine side in our house or shut the door to watch sport). There is dramatic tension almost from the first page. The background descriptions of the characters and the setting were fantastic and really fed my technicolor imagination. The use of the Gothic convention of nesting (a story within a story) was deployed with great efficiency adding significance to the main plot. There is clever use of the history of the civil war intertwining the story, although I can appreciate the detail and depth it added to the story it is probably easier to relate to if you are American and studied the Civil War. The references to To Kill a Mockingbird were intriguing and have certainly inspired me to read it. I found the description of Ethan's aunts an ingenious parallel to the mythical fates or even the witches in Macbeth. The references to religion and voodoo were extraordinary and well written, the cross-over element between religions was enlightening. Although, I found the classification of all paranormal/supernatural beings as Casters was too much of a generalisation for me, I appreciate that all things contain good and bad elements, the yin and yang if you will, but I like my neat little categories Vampire, Witch, Shifter, etc but that is just a personal preference. The Gothic imagery was fantastic, I especially liked the description of the libraries (I wonder why!). The use of Latin and Welsh (yeah! WELSH) was just fantastic (not that I am biased because I am Welsh). The action is tightly packed towards the end of the book and the ending is a cliff-hanger. However, there were some elements that bothered me, I found the relationship between Ethan and Lena to be very intense considering their ages (15 & 16) perhaps it is just he mother coming out in me as I do not think I would be very happy if one of my daughters was in such an intense relationship at that age. I guess the point is that soul mates/reincarnation has no age limits. I also found Amma's changing attitude to Lena to be a bit confusing. On the whole an enjoyable paranormal romance/thriller with some terrific quotes.",Emma Davies
9780141326085,"I haven't seen a bad review about this book yet so my expectations of this book were exceedingly high... and I think that ruined it a bit for me. Don't get me wrong, I still thoroughly enjoyed this masterfully written tale, but just not as much as I thought I would. First of all, I loved Ethan. I thought he was extremely sweet and honest protagonist. He wasn't pretending to be a saint, but nor did he do anything bad. Lena on the other hand... I just couldn't bring myself to like her. I tried very hard, but I just couldn't feel a connection with her, and I couldn't see why Ethan liked her so much. Link was another character I adored. How he can manage to be so laid back and funny with a mother like his I'll never know. And he really was funny; I would have loved for there to be more of him in the book; with quotes like: ""Shut up. You're so whipped I should buy you a saddle."" I found the plot to be unique and the writing engaging. I loved the To Kill A Mockingbird (by Harper Lee) references and found the similarities between Gatlin and Maycomb astounding. Beautiful Creatures is almost a modern-day fantasy version of TKAM. Having said all of that, I will definitely re-read this book and I'm eagerly anticipating the sequel! Overall, I'm giving this book 4 and a 1/2 stars out of 5. It misses out on that half a star for me just because I could connect with Lena, but that doesn't mean anyone else will have the same problem. Therefore, I recommend this book to everyone who loves fantasy, To Kill A Mockingbird and YA literature in general.",Amy Mansell
9780316123518,"My review: This has been my favorite thus far in the series. There are so many twists and turns and I was always trying to guess what was going to happen next. It was action-packed and the secret quotient was definitely raised. The weaving themes of love and sacrifice, both romantic and not, was beautiful and it makes the reader look just a little differently at them. The characters were as strong as they have ever been, as real as possible when created within the pages of a book. I was swept right along with them through their highs and their lows. I actually did my fair share of crying, ugly crying, at points! Things to love about Beautiful Creatures... --The mood. This is most definitely NOT a ""feel good"" book! But I liked that because it was raw and heart wrenching and real. The feelings that it evoked were intense and engrossing. --The ending. Not that I wanted the book to end, but the cliffhanger was good! Things I wanted more of... --The supporting characters. So much of this centered on Ethan, which was great, but I have grown to enjoy a lot of the less central characters. My recommendation: Love, love, LOVE so definitely pick this up!",Kim
9780316123525,"This is one of my most favorite series, I love it! Beautiful Chaos picks up where Beautiful Darkness leaves off. Ethan and Lena are trying to find John Breed and fix the mess that he left. School is staring and Ridley is joining them. Link is a ladies man now and this causes major problems with Ridley and the cheerleaders. Amma has turned to the dark side and all of Gatlin is drying up and the heat is unbearable. If that wasn't enough, everyone's powers are messed up. Anything I write in this review is not going to do any justice. I loved everything that was written. There are so many ups and downs, twists and turns and just too many things to write about. The characters come more into their own in this one. The story line is well written and I just love the whole southern vibe. I love Ethan and Lena's love story and how they stand by each other no matter what. Ridley and Link are just too funny, they are some of my favorite characters in this series. I was pleasantly surprised by a new relationship that develops, you'll have to read the book to find out who it is. I enjoyed learning about Sarafine and who she was before she turned dark. Macon is always popping up when you least except him to which just makes it more interesting. Oh yeah and I can't leave out the cliffhanger ending. Yeah it's the best one yet! Again, I can't express how much I LOVED reading this. Each time I read the next one it surprises me how much it tops the previous books. If you haven't started reading the Caster Chronicles series you should, it's amazing! I can't wait for the next one!",Unknown
9780316042673,"Also reviewed on my blog, the Vintage Bookworm. (www.vintagebookworm.blogspot.com) Okay, I'm going to start off by saying that I don't read many books that have males as the main character in the story. I guess it's because I relate better with a female point-of-view, so when I first picked up this book, I had no clue it was told in the POV of a male. For some reason I had always thought it was a female. When I found out the main character was a male, I was worried that I may not be able to get into it. Which I am VERY glad to say I DEFINITELY got into it. I was hooked after only a few chapters in. Sometimes it seemed like the story dragged on, but then something would happen that would make all of that alright. I would easily fly through 20 pages without realizing. It took me longer than it should have to read Beautiful Creatures, I guess because I didn't want the story to end. (Even though I know there is a sequel.) Garcia and Stohl did a great job at keeping the story captivating and unique. The story wasn't predictable at all, which I absolutely loved. I hate being able to figure out what will happen before it happens. It's much more fun being completely surprised to the point your jaw drops. (Which happened a lot, by the way.) They did an awesome job at the descriptions of everything, I could easily picture everything and felt as though I was right there experiencing everything. Their details are amazing! I also love the fact that this novel is a mixture of different things; romance, mystery, historical facts, magic! All of the characters felt real. Besides Lena and Ethan, I really loved Uncle Macon. He was hilarious and had me cracking up at nearly everything he said. His secret REALLY surprised me. Which I'm not going to get into because I really want it to make your jaw drop as well. :) Overall, there isn't really much I can say about this book other than I loved it. I can never really explain all the reasons why I loved a book. Especially one that has made it to a favorite. I guess I've been saying that a lot around the blog. I've been picking out great books to read.",Amanda
