ISBN13,Review,Author
9780545340977,I think it was awsome I loved how it shows all the geronimo stilton books,Paul Hayes
9781409303183,I think it's very important to share books with children for a very early age. My 10 months daughter loves these tiny books! She can turn the pages so easily!,Anita Romhalmi
9781409303183,"This collection comes in a mini-sized hard board quality packaging. The books are smaller than expected but am satisfied with the quality. The stories in each of the 6 books are rather short and concise, even simpler than Maisy's or Spot's in my opinion. My 4 years old daughter is still entice with this new addition. With a price like this that comes with free delivery half way across the globe, I give it a thumbs up!",May Wong
9781409308645,"terrific story, great size and price.",Jodie SCarlett
9780723271307,"My daughter loves this book, the wonderful pictures and sweet story. The size is also perfect for her little hands, so she can hold the book herself and turn the pages!",Sorina Ioana Crisan
9780723271307,"I bought this book for my 18 month old daughter who is a huge fan of the 'Peppa Pig' television show. It is a nice, sturdy edition and a pleasant Easter story for Peppa fans.",Diana Boswarva
9781409309062,"My 25 month old daughter is a huge fan of Peppa Pig, but I found 'My Daddy' too sarcastic for a child's book. I am huge fan of this series and books, but this one just missed the mark.",Diana Boswarva
9781409312154,"This is a lovely book for Peppa Pig fans to use to bond with their mother. It's sturdy, bright and familiar for little ones.",Diana Boswarva
9780723271789,I bought this book for my then 20 month old daughter to help with the shock of the arrival of her younger sister. It is my personal favourite board book from the Peppa Pig board book series and is highly recommended for Peppa Pig fans.,Diana Boswarva
9781409313205,This is a lovely book for Peppa Pig fans. I only wish that it came in a board book edition for little hands.,Diana Boswarva
9780718197193,"I purchased this book last Christmas for my then 16 month old daughter and she loves it. It is a lovely addition to any little Peppa Pig fan's library. The book is bright, sturdy and festive.",Diana Boswarva
9781409308614,"I got this peppa pig sticker book for my 2 years old daughter who loves to watch peppa pig show. This activity book is cute with stickers and all colored pages but there are 3 cutting activity pages that's just on the other side of different activity page. If you cut the page, other activity pages get cut. They should've put blank page for cutting activity pages. All the activity contents seem to be pretty boring, to me. My daughter hasn't seen this book yet so maybe it's fun for toddler kids... On the other hand, the book was delivered in 7 days which I expected longer than that. (I live in the States.)",Yuzuko Huffman
9781409306146,This is a lovely and festive board book for Peppa Pig fans. My 26 month old daughter loves it.,Diana Boswarva
9781405220989,"Tintin is a milestone in the European comics and in children litterature as well, just like Jules Verne was in his time. But don't get it wrong: the great cycle of Tintin's adventures starts with The Blue Lotus (you'll want to read The Pharaoh's Cigars in order to get the beginning of the story), in which book Herg, thanks to his Chinese friend (in real life) Chang Chong-Zhen, wrote and draw the kind of realistic yet humoristic story that would make the real grandeur of Tintin. For those who read french or dutch (hoping an english translation will be published one day), I really advise to read ""Herg: Son of Tintin"" by Benoit Peeters.",a Book Depository customer
9780746093368,1111,Tseng Shuyu
9780746071489,"This is a cool book for young kids to enjoy the feel of different textures and learn sentence structures (in this series, the sentence structures are repeated, just the nouns and adjectives change, which is great for language learning). But I found this book had less of a variety of textures compared with ""That's Not My Polar Bear"", ""That's Not My Mermaid"" or ""That's Not My Dragon"".",Vanessa Smith
9781409516828,"This book is nice, different textures to explore but it doesn't tend to hold attention as well as some other books and is fairly short. Still nice to have it on the shelf.",Leanne Thorn
9781409525486,"This is a great buy. Like all the books in this series, it is a cool book for young kids to enjoy the feel of different textures and learn sentence structures (in this series, the sentence structures are repeated, just the nouns and adjectives change, which is great for language learning). There's a wide variety in the textures presented, the illustrations are vivid and my son particularly loves the page with the dragon with the 'slimy' spots.",Vanessa Smith
9780746093696,"My girls love any books we can find in this series. The 3 year old likes to read them aloud herself, and the 8 month old loves feeling the pages.",Freya
9781409545989,"We already had an older copy of this wonderful book, so I ordered another as a gift for a friend. Although it is still a fantastic book (like all the books in this series, it is a cool book for young kids to enjoy the feel of different textures and learn sentence structures. In this series, the sentence structures are repeated, just the nouns and adjectives change, which is great for language learning), I did notice that a lot of the illustrations are now pinker!! The mermaid's 'scaly tail' has gone from a shimmery blue-green to metallic pink and several other illustrations have had other colours swapped for pink. That was disappointing. Still love the book.",Vanessa Smith
9780746080320,My 5 month and 25 month old daughters own this book and it is a lovely 'touch and feel' book. It enlightens children's senses and is durable. A great gift for newborns.,Diana Boswarva
9780746037782,"This is one of my 18 month old daughter's favourite books; has been since she was five months old! A great next step from black and white books. She loves to turn the pages of the book by herself, and is attracted to the different textures and colours. She now has quite a collection of other books in the series too. Fantastic book!",Sherryn Toomey
9780751355277,"Bought this book when my first child was a toddler. It's a fab book with nice clear photos of all the things young children know and can name or point at. 8 years and 3 children later I am buying it again as there are just no other books of this type nearly as good. My husband and I are both teachers and so very aware of childrens books, and our children have hundreds, but this is the best by far!",bonnie ash
9780756939519,amazing,diego
9780761156987,"This is more like a pamphlet than a book. Very disappointed. It may be indestructible but it has no words and no substance. I agree the pics are pretty - but in my opinion, too pretty too appeal to babies. However, I am sure my daughter will give it a good chew and be quite happy with that.",Lisa Fallon
9780606115698,"""Excellent Adventure. Endings are fab!. Enjoyed Reading. On a Scale Of 1/10 I'll Give It a 9/10.""",a Book Depository customer
9780606103589,"""Great Read. The Monsters Are Great and sad Endings. Except It's you Who chooses The Scare thats why a knocked a star off. """,a Book Depository customer
9780606086455,"""Not Really Good but The Endings Are Incredibly Scary. On a scale 1/10 I Would say a 4.""",a Book Depository customer
9780606120005,Scary and hard choices to make. You Better move out the way a tornados going to hit!. That is a choice you have to make unless the toy doll Sets fire to your house!.,a Book Depository customer
9781444011678,"The returning heroes As a child I used to love going to the library and reading all the Asterix books they had, he was my favourite better than Tintin and with his friend Obelix they were my heroes as they always beat up the invading Romans. Oh how I have missed you my old friend, but not anymore! With a new writing team, Jean-Yves Ferri and Didier Conrad and they have continued in the tradition of Rene Goscinny and Albert Uderzo. This time, Asterix and Obelix are off to Scotland to fight the Romans and collaborating Picts against the other clans. When a Pict is washed up outside their village all the women fall in love with him and the men folk cannot wait to send him back. Asterix and Obelix take him back to his clan in Scotland so he can find his love and marry her. Along the way there are all the old puns, the old wit and plenty of humour of the slapstick variety. There is plenty of fighting and then Obelix finds his joy at the end when he can fight Romans. This book is an excellent reminder as to why I originally loved the whole Asterix series and it is great to see the book back. For us of an older generation it is a return to form and we should be encouraging people to read this once again. I cannot recommend this fun book highly enough go and buy it for the kids, schools get it on your shelves today!",Paul D
9788434568280,"Buyer beware - if you are looking for the usual type of Asterix book, this is not it. It looks like a ""book of the film"" edition, with a few big pictures per page and lots of prose. Just so you know.",Jean Anderson
9781613772355,"Some of the most fun, exciting and well thought out sci-fi comics you'll ever read about the crew of a spaceship on a cruade...who just happen to be giant transforming robots. There's mysteries and action galore, but what's amazing about this stories are the character insights and how (some of) the characters develop - tailgate, swerve, cyclonus, chrome dome, even ultra magnus and yes, later on, glimmers of whirl. It's a big cast but they are so well written they each have a distinct personality that goes beyond 'red car robot, blue helicopter robot'.",Andrew Irwin
9781613772355,"Although I huge fan of Transformers since I was a kid, this series has disappointed me. I didn't even last to the third volume. Boring to death. Too bad..",Constantine Fountos
9781613775554,"Reason for Reading: I used to love the Transformers comics and cartoon plus I loved the first movie. I was never a serious reader of comic books so not hooked on storylines but did pick up various issues here and there and loved reading them. This volume is a continuation of the original series which ended in 1991, I believe. It is 21 years later and the story picks up where it left off with what has been going on in the meantime and what the crisis is now. Loose ends from issue 80 are tied up and the first issue here is numbered 81. It helps if you have read the old comics as many references are made to past events with asterisks referring you to specific issues anywhere from 1-80, though mostly #'s 75-80. As a ""guy on the street"" fan of the Transformers I loved the story, and while not all that familiar with the history knew enough of Transformer lore to understand what was going on. Fans will be thrilled with the return of many familiar faces from the past and of course, we are not disappointed with the ultimate Optimus Prime vs Megatron battle at the end and the writer's don't go easy on our hearts either with a couple of deaths which seem to come far too soon in a story just started. Seems like a series that will be great fun for fans old and new. Quite appropriate for all ages as well who can handle the robot violence. Fun.",Nicola Mansfield
9780141324906,"I couldn't see why this was in YA/Teen section in the library, cuz I'd rather call this a Children's book. It was funny though... Jeff is a good cartoonist, that made this funny at some points. This is a perfect children's book, I would bet that my little brother would love it. I felt that it got a bit too silly with the nicknames... I don't recommend it to YA readers, but It's an easy read if you just want something to read while you're at a holiday or something. There aren't any chapters in this book but it's divided into months and monday-sunday, just like a diary... It has really awesome drawings and it's really quick page turner... I didn't feel captivated with any of the characters. The story didn't have any remarkable ending either...",Sindre Ellingsen
9780141324906,"The Diary of a Wimpy Kid series is one of the funniest children's book series ever. The book itself is very well designed, with the front cover actually looking like a diary (The first line of the book: ""Let me get something straight: this is a JOURNAL, not a diary.). The cartoons on the inside of the book are also very well drawn, with the pages being lined, just like in a journal. This is the first book in a quite long series by Jeff Kinney. The story is about Greg, a self-centred boy who thinks he's going to be famous, and his day-to-day adventures. This book is an excellent read and I urge you to go and get it RIGHT NOW!",ReviewerOfReviews
9780141324913,"The Diary of a Wimpy Kid series is coming along very nicely. The first one almost made me cry because I was laughing so hard. This one, I'm sure you're delighted to hear, is as good as the first. It follows the same format (looks like a diary, lined pages), but it's missing something......zing. The first one was incredibly funny, but this one just feels like an expansion to the first. It just doesn't feel like it's own book, if you catch my drift. On the bright side it does come with a very nice Loded Diper sticker. I really like this book but it just feels a bit...repetitive.",ReviewerOfReviews
9781419705847,"I love these books. My 9- year old loves them too, of course. A great read for kids.",Mario Vega
9781419705847,"Oh, dear! Another ""Wimpy Kid"" book. Will they ever end, or will we follow Greg Heffley all the way to the nursing home? I actually asked the publisher not to send me any more of these books because I really don't like them, but I am a book reviewer, so they send them anyway. I realize that they are immensely popular with many children and that some critics have praised them to the highest heavens as being truly in tune with the problems and angst of the modern middle school student. This may be part of the reason why they simply don't appeal to me whatever. I was in ""middle school"" (we called it upper elementary and junior high then) back in the 1960s, so the events and feelings of Greg are very far removed from my own experiences. Furthermore, the things described in the book are exactly the kinds of negative public-school related experiences from which Christian parents who homeschool wish to shelter their children. In The Third Wheel, Greg, who I believe is just in either seventh or eighth grade now, is really concerned about not having a girlfriend, especially with the upcoming Valentine's Day Dance. This may seem strange to a lot of folks, but at one time nearly all religious people opposed mixed dancing, and there are still a few of us around today. These kids are but twelve or thirteen, yet there is a lot of talk about getting a date and how to go about it. This is only middle school, yet Greg says, ""It's hard to keep track of who has gone out with who in my school,"" one boy boasts ""that he's kissed a bunch of different girls in my grade,"" and one couple has ""been going out...since the fifth grade."" Whatever happened to protecting the innocence and purity of children rather than pushing them into sexualized situations at earlier and earlier ages? I guess that this is what disturbs me most about these Wimpy Kid books, especially since they're marketed to children as young as eight. In addition to the dancing and the dating, there are references to other such wonderfully educational experiences in school that leave such pleasant memories as kids having toilet paper fights, people making obnoxious noises at a fellow named Bryan Buttsey, and guys getting ""pantsed."" Also, Greg's Uncle Gary has been married four times, spends what money he has on scratch lottery tickets at the convenience store, and is addicted to a virtual-world computer game-a really great role model! Thankfully, the language is not too bad, with only a couple of common euphemisms (heck, dang it), although Greg does use the expression, ""God knows what else."" There may actually be some real humor somewhere in the story, but it's completely lost on me. Admittedly, young people could be reading worse, but they could certainly read a lot better. So far as I can tell, there is simply nothing in the Wimpy Kid books that would be of any interest to godly people.",Wayne S. Walker
9781419706424,"First there was the Diary of a Wimpy Kid book, said to be a realistic fiction novel, by Jeff Kinney, which appeared on FunBrain.com in 2004 and was released in hardcover on April 1, 2007. Next, there have been several sequels, including Rodrick Rules (2008), The Last Straw (2009), Dog Days (2009), The Ugly Truth (2010), the only one that I have read, and Cabin Fever (2011). The seventh, The Third Wheel, is scheduled for release on November 13, 2012. Then there was a Diary of a Wimpy Kid film that was released by 20th Century Fox on March 19, 2010. After that, there were two more movies, Diary of a Wimpy Kid: Rodrick Rules, based on book two of the Wimpy Kid series in 2011, and Diary of a Wimpy Kid: Dog Days based on books three and four in 2012. Now, there is a tie-in book, written by Kinney, called The Wimpy Kid Movie Diary. It was originally published in 2010 and included film stills, script pages, storyboards, preliminary concept drawings, some new illustrations, and also behind the scenes information to chronicle in a humorous way the making of the film. The latest edition gives the story of all three movies. It begins with some background information about the original book, explains how it was made into a film, and then tells about the two movie sequels. Though the books, which chronicle in diary form how Greg Heffley relates to his dad Frank Heffley, his mom Susan Heffley, his older brother Rodrick, his little brother Manny, his best friend Rowley Jefferson, other kids at school, and people in the neighborhood, have been highly praised and very popular, I must be honest and say that they do not hit my hot button at all. However, those who do like the Wimpy Kids books and movies will undoubtedly enjoy this companion to the series and find it interesting.",Wayne S. Walker
9781419702235,"This book is the sixth book of the Diary of A Wimpy Kid series. I'm 15 years old, and im proud to say i own all books, and i absolutely love each and every one of them! I was so excited to read this one, but i might have been a bit disappointed. First of all, all of the series is a fun-fast read. They are all really funny, and even Juhina, yes Juhina, my 21 year old sister, loves them too. I felt like this book wasn't as funny as the first five. I just felt like it lacked the Greg spark, that always seemed to make the book hilarious. I guess there wasn't much funny interactions with his mom and dad and lil brother manny, which i loved reading about. There isn't much to write about this book, since half of the book is pictures. So i really hope the next book will be funnier than this one.",Juhina & Farah
9780810970687,"My daughter just finished reading this book, and it has quickly become a favorite of hers. In her words, this is her review. i really liked the fact that the writing looks like it is handwritten. i also like that it has a picture on each page. I preferred reading this book to watching TV or playing WII. I was so happy when my mom said I could read it! I can honestly say that I love every word in this book-even the end! It had some of the best funny parts, and I love going back and re-reading my favorite parts.",Ruth Hill
9780810983915,"Greg Heffley wants to spend his summer indoors, relaxing, playing video games with his friend, Rowley, and watching late-night horror films. His mom has other ideas, however. She wants him to spend time with the family, improving his education, and playing outdoors. Greg tries to implement his ideas of summer, but without much success. He tries to spend time with Rowley kicking back at his friend's father's country club, but gets permanently uninvited when he accidentally tells the clubhouse manager his complaints about the place's service. Things only get worse when his mom tells him he has to find a way to pay off half of the smoothie bill he and Rowley racked up. When Greg's father comes home with a dog that won't leave him alone, he's soon at his wits end. With failed attempts to earn money, a falling out with his best friend, and a crazy dog, will Greg ever survive summer? Will he find some way to make this into a great summer, despite the rocky start? This fourth installment is an excellent addition to the other three stories. Greg's true character really comes out in this novel as he discovers who he is, learns to balance everything that's going on, and takes an easy-going approach to life. The illustrations are well-done and only add to the book's humor. Avid and reluctant readers alike who have loved the other DIARY OF A WIMPY KID books, who like humorous stories, or who prefer reading realistic fiction will all enjoy this one.",TeensReadToo
9780810994737,"This book has GREAT humor! Sequel to Diary Of A Wimpy Kid, it's abosolutely hillarious. I agree, I can't wait to read Book #3, #4 and #5. Chirstmas present, anyone? Totally good for Christmas if your child or even YOU loved Book #1! Plus, I can't wait to see the movie that's just come out!",Alice
9780810994737,"It's DIARY OF A WIMPY KID #2, and I can't wait to read #3. These books are fantastic. The tales and adventures of Greg Heffley and his creative illustrations are well worth your time. Greg begins his second diary. He almost decided it wasn't worth it after Rodrick got his hands on the first diary, but once again he writes about his frustrations with his older brother, Rodrick, and his younger brother, Manny. Greg reveals all the embarrassing encounters involving his mother's determination to butt into his life. He also includes tales of his bumpy relationship with his best friend, Rowley. Imaginative cartoon drawings combined with fresh, wacky humor make the DIARY OF A WIMPY KID: RODRICK RULES popular with even the most sophisticated readers in my middle school. Everyone considers it just plain fun to read. Anyone who is currently striving to survive middle school, or anyone who remembers the pain, is sure to appreciate the good-natured humor in Jeff Kinney's creative series.",TeensReadToo
9780810993136,"If you work with middle grade kids, be sure to check out DIARY OF A WIMPY KID. Greg Heffley is a 6th-grade weakling trying to make his mark in the middle school world. His family includes a mom, a dad, a heavy metal big brother, and a whiny, tattling little brother. His best friend is Rowley, another odd 6th-grader with overprotective parents and the world-class ability to annoy. Greg is always a victim of the big, mean bullies in the school. He constantly seems to be in the wrong place at the wrong time. In an attempt to be ""cool"" he experiments with the idea of weightlifting, creating his own haunted house, running for class treasurer, and building a snowman big enough to be considered for the Guiness Book of World Records. However, the only mild success he accomplishes is as a safety guard whose job is to walk the kindergarten kids home at lunchtime. At least with that job he gets free hot chocolate and misses twenty minutes of math class. Readers will be able to relate to Greg's typical teenage problems. His parents ground him from his video games, his older brother picks on him, his little brother gets him in trouble, and the girls in his school think he is a waste of their time. He'd like to pretend he's just a mediocre student when he is really one of the ""uncool"" gifted kids. The odds are just stacked against him. Kinney bills his books as ""a novel in cartoons,"" which is sure to be a popular feature with middle grade readers, especially those of the reluctant variety. The clever illustrations were a fantastic way to play up the already great humor in the book. Once again, if you have anything at all to do with middle graders, get this book in their hands ASAP.",TeensReadToo
9781419700507,this was a good book to read it told you a lot about how the movie was made. Also how diary of a wimpy kid started of however I prefer the other diary of a wimpy books.,Nicholas
