ISBN13,Review,Author
9780399256752,"Set in a futuristic Los Angeles, the world of Legend is both oddly familiar and completely foreign. The United States no longer exists, and the western states have been enveloped into a new governmental entity known as the Republic - a militaristic state ruled by the ever-elected Elector Primo and Congress. Individual freedoms have been severely limited by the government and every citizen, at the age of 10, is required to take a trial or a test that will determine the course of one's life from that day forward. If a child scores high enough they will be granted a college education and a promising future with the Republic. If too low a score, the child will be sentenced to a life of dangerous menial labor, poverty and possibly infection by plague. Those who fail the test completely are sent to labor camps, all in service of the glorious Republic and Our Father, the Elector Primo. Day is a boy who failed the test, a boy who knows firsthand the truth about what happens to the children who don't pass the the Republic's trial. Having escaped his fate, he now creates as much trouble for the Republic as he can by destroying military property, stealing supplies, and hindering the war effort against the Colonies. He steals, bets, and scrounges to survive on the streets, constantly on the watch for Republic patrols who consider him enemy number one. Intelligent, intuitive, confident, and endearingly cocky, Day is a hero and a symbol of hope for the Republic's less fortunate. Day's primary concern though is caring for his family who, with the exception of his brother John, think him dead. He checks in on them from afar, provides for their needs when he is able and receives updates on their situation from John. When his family's front door is suddenly marked as infected by the plague patrols, Day is consumed by one goal only, an objective that will lead him down an irretraceable path. June, on the other hand, was born into a life of privilege. On her tenth birthday she aced the Republic's trial becoming the only child to ever receive a perfect score. Now, the Republic's golden girl, she is receiving the best education possible, being prepared for a much-anticipated military career in service to Elector and country. Incredibly bright and often bored with her studies, June is something of a troublemaker at her university, challenging herself to new heights of achievement with stunts that are frowned upon by school officials. However, once her brother is murdered, June is pulled out of training and put into the field. No one has been able to catch the elusive miscreant-turned-murderer known as Day, and if anyone has a chance of catching him June's superior officer is betting on the Republic's vengeance-seeking, star pupil. In addition to being extremely intelligent, June also displays a fierceness, a strategic mind, a sense of decency, and a hyper-intuitive eye. She is tough as nails, but she has a complete love for and an unshakable loyalty to her brother. Because of this vulnerability - this decision to love her family above the State - June becomes more likeable and more than just another mindless, propaganda-spouting drone. For readers who appreciate a strong, independent female lead, June is sure to please. One of the recurring themes that appear in dystopian novels seems to be that of the state vs. the individual. It's fascinating how a group of people, such as the Republic soldiers, can be indoctrinated to the point that their compassion for the individual is no longer a factor in their thought process - that a single human life or multiple lives can be stolen without a second thought, without any empathy at all. The Republic pawns have been robbed of their conscience, or perhaps they consciously choose to ignore that little nagging doubt, so that they may instead enjoy power, privilege and safety. It just never ceases to amaze how people can go along with such atrocities so blindly, and more horrifyingly perhaps, believing in the rightness of their actions. The overall blind devotion to the State, the unwillingness or inability for independent analytical thought, the substitution of the government modus operandi for one's personal/religious moral code is terrifying, and Lu communicates this very effectively. In addition to the wonderful characters and the interesting themes, the plot of this story is also very compelling. While not, perhaps the most complicated of mysteries when all is said and done, it's woven together well, and half the enjoyment of the mystery lies in the way that it's presented, is it not? It's well-paced, the danger is convincing and Lu is able to capture a real sense of gravity - a sense of helplessness and pain in the face of overwhelming odds - and it propels the reader through this story with the hope that June and Day will somehow be able to overcome the obstacles they face. Told in tandem by June and Day, Legend is yet another book that employs a shift in first-person narrator from chapter to chapter. And it is another book that uses the device quite well, as the reader is given a front row seat to June and Day's thoughts and motivations. Overall, Legend is dystopia well done. A fantastic debut that's bound for the keeper shelf.",Dani @ Refracted Light
9780399256752,"Legend by Marie Lu is AWESOME!! I really liked the flow that Marie Lu vividly illustrated through her well written story. I was surprised on how deeply engaged I was because I had my doubts with the simplicity of its cover, but within that cover there is nothing simple about it. Rich in action, intrigue, and suspense, a dystopian novel that will keep you awake through all hours of the night. Legend beckons you and I can't help but to ask for more! Daniel ""Day"" Altan Wing took his trials when he was only 10 years old. Every kid in the Republic takes their trials at 10. It decides whether they will be placed in the higher rankings of society or be one among the back breaking laborers living in the slums. And Day was among those who failed. With poor results he was taken into the labor camps along with the other children who didn't receive high scores. The twist is, there isn't such a thing as the labor camps. And all those who went, never came back or seen again. June is the prodigy of the Republic. She is the only one who scored a perfect 1500 on her trials. A bright future is ahead for her; and at such a young age (15 years) she's already a well decorated officer. Everything runs smoothly for June until Day comes along and kills her older brother, Metias. Left with no parents and now her brother, she begins her agenda of bringing down the Republic's elusive criminal, Day, and she's going to make sure he's going to get what he deserves. Legend by Marie Lu alternates from Day's voice to June's, but you will never mistake who your reading. Along with each character having their own designated color text, Day's being gold text and June's being black, each of the two is a distinct character with two complete different voices. I am amazed on how fluid I read Legend. It doesn't skip a beat; when June stops her tale Day picks it right back up where she left off. Another favorite I will add to my collection. I am on the edge of my seat eager for Legend's sequel!! I RECOMMEND!!",SpadesHigh
9780399256769,"Legend captured my attention with its action-oriented story line, and likable characters that I couldn't get of; Prodigy delivered all of that and more in this exceptional sequel. Reasons to Read: 1. Flawless plot continuity: Prodigy perfectly builds on the story first introduced in Legend; there's no lull, and importantly Marie really expands on the plot lines and twists revealed in the first book of the series. 2. Strong world-building: Legend stands out among other futuristic YA books for its impeccable world-building, and this only improves in Legend. We get to see a bit more of the world that June and Day live in, and experience new places at the same time as the characters do. 3. An action-oriented book: I love books that are bursting with action and thrills, and Prodigy is exactly that. June and Day are both tough characters, in their own way, but their courage puts them in trying situations (which means that the reader gets plenty of excitement and action)! 4. A romance you can root for: One of my favourite things about June and Day's relationship is that they're working for it. This rarely comes up in YA books, and I'm so pleased to see characters that try to communicate with one another, and while they aren't perfect you can easily see that their relationship doesn't just magically work out. It's a refreshing take on a love story, and one that is realistic too. I also love all the details and attention Marie pays to the secondary characters and their stories, and it comes across so well in Prodigy (Metias will forever and ever be my favourite). That being said, at times it almost feels like there's a little too much going on for me to really understand and appreciate all the side stories that are happening. It can take away from the overall story, although I understand that this is hard when you have such a large fictional world and only three books. You just can't fit everything in. ARC received from Penguin Canada for review; no other compensation was received.",Brenna Staats
9781442445932,"Shannon Messenger. A name that you should get familiar with. She is an author, and a damn good one. Her first book - Keeper of the Lost Cities, published by Aladdin on 10/2/2012, is quite a wonderful debut. Chronicling the adventures of young Sophie Foster, whose world is turned upside-down in the Natural History museum, the book is a magical romp through a world of Ms. Messenger's imagination. No, no spoilers here - that's not fair. But I will say a few things. First, though this is aimed squarely at the YA market, I had NO issues with the writing style at all. It is, simply, well-written. It romps, it rolls, and it pulls you in in about three pages. Look, I'm a quick reader, but I finished this nearly-500 page book in less than two days (during which time I also did.. well, lots of other stuff). Second, the characters feel real. They are unique voices, consistent, and well-defined. And they don't read as 'stock' characters - although Elwin does remind me quite a bit of McCoy (though that could be my background bleeding through). Finally, and this is the big one for me - the dialogue WORKS. You have read my stuff - I do dialogue instead of narrative. It's how I write. And it's what I like to read. Well, I LOVE what Shannon did with her dialogue. It isn't forced, it isn't stilted - it flows and moves as real speech should and does. My ONLY quibble with the book is the setting of the academy for the world's kids. It feels too much like Hogwarts. Now, that isn't a terrible thing, and, given the heroine is a 13-year-old girl, I'm not sure HOW you could do a book without incorporating SOME kind of school, but it's the one bit that required a little extra 'suspension of disbelief.' That being said... Go get this book. And hope that she decides to write another (and another, and another...).",TheAdamG
9781907992391,"The Tour of Duty collections completely re-ignited my love for Dredd. Well written, amazing range of artwork and a lot of loose ends tied up from Dredd's past. I'm terrible at writing reviews but I would recommend this collection to any Dredd fan. Buy the first part before this though otherwise you may be a little lost!",Craig Burdis
9781907992674,"At the time of writing, Mark Millar and Grant Morrison are fairly notable names in the world of comicdom. Grant Morrison is a genuine talent, and Mark Millar is seen as being an important media figure with movies such as 'Wanted' and 'Kick-Ass' bearing his name. Cashing in on this is Rebellion (the publisher), building some momentum and attention to the upcoming Dredd movie. The graphic novel compiles two Judge Dredd stories from the parent title, the galaxy's greatest comic, 2000 AD. The main author of Judge Dredd, John Wagner, takes a backseat to allow Morrison and Millar to scribe these tales, back in the early 1990's; with Austin and Ezquerra on respective art duties. Crusade plays with the idea of Judges from judicial systems from around the world converging on the Ultima Thule complex in the Antarctic on the hunt for a crash-landed astronaut who has returned with a message from god. Politics, gunfire, religious pontificating, and mine-rides in talking mine-carts ensue. The pace is lightning fast, the characters highly disposable, and the tone is satirical. Frankenstein Division by Mark Millar alone is fast and furious mayhem, beautifully depicted by Carlos Ezquerra, on a one-beat premise about a killing machine constructed from dead soldiers out for revenge against Dredd, hardwired into its DNA. So is it worth it? Judge Dredd is a powerful central character and has been a tour de force in the underground that is non-American, non-Superhero comics for over 35 years now. These two tales are amongst the more mediocre offerings, and for Judge Dredd purists the only reasons for including this volume in your collection is for either nostaligia, or completing your collection. Like me. If you have bought this volume because you like the works of Morrison or Millar, then fantastic, welcome to Judge Dredd. Now go and read some good stuff. Judge Dredd stories like America, Mandroid, Total War, The Apocalypse War, The Pit, Tour of Duty, and so very much more. John Wagner is an incredible writer who has developed his vision for four decades now. So for those of you lucky enough to be discovering Judge Dredd and the future-shocked worlds of 2000 AD for the first time: then welcome to the crusade!",Paul Stewart
9781907992674,"Reason for Reading: I'm falling in love with Judge Dredd and his whole post-apocalyptic world. I gave this book 5 stars but I'll let you know right away it certainly wasn't for its literary merit. There was a lot of cheesy dialogue and readers of modern comics may not be able to get past that. But I have to say I love to laugh at the cheese in my comics when it comes to superheroes and villains. The Judges, including Dredd, are the heroes of these books but one doesn't necessarily side with them or like them. They are ""better"" than the villains but then these judges are police, judge and jury rolled up into one person who makes a judgement call in matters of seconds with each case they take on. This book is divided into 2 separate stories taken from the pages of ""2000AD"". They are random stories both written by Morrison & Millar with a very weak connecting theme that they are both set in an Arctic cold location. The first story in the book is ""Crusade"" first published in 1994 is set in the South Pole and has an ""Alien"" vibe to it as they know a monster is hidden in the secret lab where representative Judges (the best of the best) have been sent to get this former man back to their official respective Cities and learn his truth. I really enjoyed this story. It was much longer than the second one and covered 10 issues. The plot built up rather speedily. Though it did lag a bit in the middle, The authors did manage to quickly pull it back up and gave us an action packed story. I was a little irked that the bad guy had to be the Vatican City, complete with his ""Inquisitor Judge"", but what can you expect from anti-papist Brits anyway (I'm British so I'm allowed to say this kind of stuff :-) The second story ""Frankenstein Division"" is much shorter and comes from 1995. This one has the Soviets as bad guys in the sense that one of their inventions, a super judge made from remnants of judges that had been killed by Dredd during the Apocalyptic Wars, has escaped from Siberia with one thought on its mind: find and destroy Judge Dredd. A great bit of battle action and behind the scenes dirty politics as we see how ""justice"" is handed out to those who let the super judge escape in the first place. I'm loving these books and glimpses into the Judge Dredd universe where Judges are police, judge, jury and sentencer (though mostly executioner) all in one person!",Nicola Mansfield
9781781080320,"Reason for Reading: I love the Judge Dredd universe! While the title may have you thinking differently, this book has no paranormal activity until the very last one-off story. The book begins with the titular story from the '80s which is 7 parts long and almost half the book in length. ""Werewolves"" have found their way into Mega-City from the Undercity, their existence is based upon science, chemicals to be exact. I loved this story, very well done and written by Wagner & Grant. The book is published in b/w up to this point. Then we jump ahead to the 2000s for a direct sequel to this story. From here the art in the book is full colour. I also loved this sequel written by Wagner but I found the art very strange. Even though the publisher's summary tells us 3 other werewolf stories are included, these two which make up half the book are the only true ""werewolf"" stories. The rest of the book contains two somewhat thematically related one-offs. First is a story set in the Cursed Earth which features bounty hunters who are mutants descended from Navajo spiritwalkers and are permanently in humanoid dog form. This introduces (to me) a great female character named Quadrille, I hope she shows up again. Finally, is ""Asylum"" which involves the Psi-Division and a paranormal creature, a vampire. This is the first time I've met up with Psi Judge Karyn but I liked her and I found the story creepy but unexpected when the theme is supposed to be werewolves. A good collection of some of the stranger tales one can find within the Dredd universe. I prefer the proper crime stuff myself but am not against the weirder storylines at all. Good book for the Halloween season.",Nicola Mansfield
9781781080719,"Reason for Reading: I love the Judge Dredd universe and I've heard of Titan mentioned in previous stories so this was fairly exciting to take a look at a story set on the planetary penal colony for criminal judges. The book consists in total of four stories. First of all come two back to back sequential stories which take up 90% of the book. ""Purgatory"" shows us life on Titan for all those there, both the convicts and the guards, under the sadistic rule of Governor Khurtz. Judge Grice and his followers have just recently been sent to the colony for trying to kill Judge Dredd and it would seem that is a common crime amongst the inmates. We learn that not only are the prisoners abused and maltreated but are also being experimented on for scientific experiments and Khurtz's personal enjoyment. Titan is in possession of two mighty weapons that could wipe out the population of earth and this causes a riot between the inmates and the guards which leads us to the titular story ""Inferno"". Here the prisoners have taken over the asylum with Grice as their leader. They take the weapon and head straight to Mega-City One to take it out and take over what will be left of it. This storyline ends up nicely, though brutal. The Dredd that we experience hear is one of no regrets, one out to get the bad guy no matter what, all means will justify the end. Almost every page of this story is brutal violence as we see mankind at his most base sinful nature. A gripping story with some mentions of past events that are intriguing and make me want to catch up on all the storylines in between I've missed out on. The last two stories are very short, one-off episodes. I've already read a Judge Dredd Christmas story and this book includes another called ""I Hate Christmas"". A few pages of Dredd working on Christmas eve showing exactly why Dredd has every reason to hate the season. Finally ""Top Gun"" is presented as a one-off where Dredd meets one of the tech guys who suits him up with some new gear, a new gun and bike supposedly with the latest, greatest upgrades. Off to settle down a cube breakout, Dredd's new gear malfunctions and in the end he dispatches ""Joe Dredd justice"" to all those who deserve it. Again these stories are violent and brutal but these two have some dry humour to lighten things. Great volume!",Nicola Mansfield
9781781080290,"Reason for Reading: Latest Judge Dredd release. These collections of Judge Dredd graphic novels usual revolve around a writer, but this time the stories all share a common theme, Judges who have crossed over to the other side of the law. This collection contains quite a number of short stories and a couple of longer series that went on for several issues. I actually enjoyed all of them, though a couple were a bit cheesy, and only one I didn't enjoy and that was because of the very strange art style. The book also contains stories from the '80s up to today, presenting an interesting look at the history of the comic itself. The classic '80s style art is my favourite and the stories are certainly more aimed at juveniles, though they are rather violent. As we move into the '90s the art becomes smoother, cartoonier, more obviously computer aided and the blood flows very freely. The 2000s bring dark, adult stories with semi nudity and much violence and an accompanying dark, atmospheric art style. Judge Dredd also gets a personality in the newer stories, we find out his first name and his character is explored. An all around great collection that would make a good introduction to the Dredd character. I enjoyed all the stories, some more than others but my favourite were two that featured Judge Manners, a rogue Judge who was one nasty piece of work!",Nicola Mansfield
9781781080672,"Reason for Reading: I'm a huge Judge Dredd fan and this is the latest North American publication. At this point I recognise the names of the popular Dredd writers but I can't say I have any particular favourites except for Wagner, of course. This is actually my first time to come across Ennis in my rediscovery of Dredd this past year or so; so my attraction here was not to the author in particular but just to more Dredd stories. This book contains quite a nice selection of stories with several longer multi-issue stories interspersed with short one-issue ones. The entire book is in colour except for the last story which comes to us from the 1993 Judge Dredd Yearbook. All the stories are from the '90s which brings a nice consistency to the collection. The book begins with ""Emerald Isle"", a multi-part story which takes Dredd to Ireland and a violent tale of terrorists. Here we meet Judge Joyce who will return again in this collection. I only had two problems with this book and one was the ""cheese"" in this story. Now I like the cheesiness of early Judge Dredd as much as the next fellow but a gun invented to shoot potatoes instead of bullets was a bit beyond it; death by potato lodged in forehead, uh-huh. Otherwise a great story. Next is a short story where Dredd meets the very first guy he ever arrested. ""Almighty Dredd"" then brings a multi-parter where a bunch of kooks have created a religion around Dredd himself. Let's just say they do get to meet their maker! This is where I had my second problem. Artist Ian Gibson drew this one and used a very cartoony style which I did not appreciate at all. His work is in a lot of my books and I haven't had this problem with it before but the style just didn't work for me here. I love the '90s Dredd! His typical attitude is ""Give yourself up to the laaaaaw!"" Criminal ""Never!"" Dredd ""Brakka! Brakka! Blamm!"" ""Call in the meat."" Anyway, next up is a story with probably the most violent villain I've come across in the Dredd Universe so far, Blender McCoy. This multi-parter is violent but also a love story. A very good one. Then another multi-parter as Judge Joyce comes to Mega-City One following a couple of bad guys on the run from Emerald Isle. By the time he's finished he's more than glad to go back home. I rather like Judge Joyce. Another multi-parter of a vigilante ex-Judge called ""Raider"". Here I actually sympathized with him rather than Dredd. I love Dredd, but he can be a high and mighty jerk. LOL. This story also introduced me to my first ""Wally Squad"" (I'll be reading Low Life soon) member Judge Lola Palmtree. I liked her and hope she comes back again. Then the book ends with two one issue stories a mediocre story of the illegal drug snow, aka sugar and finally the only b/w in this book, a return to Emerald Isle with a funny but very gruesome story of a case for Judge Joyce. A great collection of '90s Judge Dredd stories!",Nicola Mansfield
